-- All the queries below should work even if duckdb.execution is turned off.
SET duckdb.execution = false;
CREATE TEMP TABLE t(
    bool BOOLEAN,
    i2 SMALLINT,
    i4 INT DEFAULT 1,
    i8 BIGINT NOT NULL,
    fl4 REAL DEFAULT random() + 1,
    fl8 DOUBLE PRECISION CHECK(fl8 > 0),
    t1 TEXT,
    t2 VARCHAR,
    t3 BPCHAR,
    d DATE,
    ts TIMESTAMP,
    json_obj JSON,
    CHECK (i4 > i2)
) USING duckdb;
-- FIXME: This should not be necessary to make this test work, we should always
-- send ISO dates to duckdb or even better would be to make DuckDB respect
-- postgres its datestyle
SET DateStyle = 'ISO, YMD';
INSERT INTO t VALUES (true, 2, 4, 8, 4.0, 8.0, 't1', 't2', 't3', '2024-05-04', '2020-01-01T01:02:03', '{"a": 1}');
SELECT * FROM t;
 bool | i2 | i4 | i8 | fl4 | fl8 | t1 | t2 | t3 |     d      |         ts          | json_obj 
------+----+----+----+-----+-----+----+----+----+------------+---------------------+----------
 t    |  2 |  4 |  8 |   4 |   8 | t1 | t2 | t3 | 2024-05-04 | 2020-01-01 01:02:03 | {"a": 1}
(1 row)

CREATE TEMP TABLE t_heap (a int);
INSERT INTO t_heap VALUES (2);
SELECT * FROM t JOIN t_heap ON i2 = a;
 bool | i2 | i4 | i8 | fl4 | fl8 | t1 | t2 | t3 |     d      |         ts          | json_obj | a 
------+----+----+----+-----+-----+----+----+----+------------+---------------------+----------+---
 t    |  2 |  4 |  8 |   4 |   8 | t1 | t2 | t3 | 2024-05-04 | 2020-01-01 01:02:03 | {"a": 1} | 2
(1 row)

-- The default_table_access_method GUC should be honored.
set default_table_access_method = 'duckdb';
CREATE TEMP TABLE t2(a int);
INSERT INTO t2 VALUES (1), (2), (3);
SELECT * FROM t2 ORDER BY a;
 a 
---
 1
 2
 3
(3 rows)

DELETE FROM t2 WHERE a = 2;
SELECT * FROM t2 ORDER BY a;
 a 
---
 1
 3
(2 rows)

UPDATE t2 SET a = 5 WHERE a = 3;
SELECT * FROM t2 ORDER BY a;
 a 
---
 1
 5
(2 rows)

TRUNCATE t2;
SELECT * FROM t2 ORDER BY a;
 a 
---
(0 rows)

CREATE INDEX ON t2(a);
ERROR:  duckdb does not implement duckdb_index_build_range_scan
-- We shouldn't be able to run DuckDB queries in transactions (yet).
BEGIN;
    INSERT INTO t2 VALUES (1), (2), (3);
ERROR:  DuckDB queries cannot run inside a transaction block
END;
BEGIN;
    CREATE TEMP TABLE t3(a int);
ERROR:  DuckDB queries cannot run inside a transaction block
END;
BEGIN;
    DROP TABLE t2;
ERROR:  DuckDB queries cannot run inside a transaction block
END;
-- But plain postgres DDL and queries should work fine
BEGIN;
    CREATE TEMP TABLE t4(a int) USING heap;
    INSERT INTO t4 VALUES (1);
    SELECT * FROM t4;
 a 
---
 1
(1 row)

    DROP TABLE t4;
END;
-- Even if duckdb.execution is turned on
BEGIN;
    SET LOCAL duckdb.execution = true;
    CREATE TEMP TABLE t4(a int) USING heap;
    INSERT INTO t4 VALUES (1);
    SELECT * FROM t4;
 a 
---
 1
(1 row)

    DROP TABLE t4;
END;
SELECT duckdb.raw_query($$ SELECT database_name, schema_name, sql FROM duckdb_tables() $$);
NOTICE:  result: database_name	schema_name	sql	
VARCHAR	VARCHAR	VARCHAR	
[ Rows: 2]
memory	pg_temp	CREATE TABLE pg_temp.t(bool BOOLEAN, i2 SMALLINT, i4 INTEGER DEFAULT(1), i8 BIGINT NOT NULL, fl4 FLOAT DEFAULT((random() + CAST(1 AS DOUBLE))), fl8 DOUBLE, t1 VARCHAR, t2 VARCHAR, t3 VARCHAR, d DATE, ts TIMESTAMP, json_obj JSON, CHECK((i4 > i2)), CHECK((fl8 > CAST(0 AS DOUBLE))));
memory	pg_temp	CREATE TABLE pg_temp.t2(a INTEGER);


 raw_query 
-----------
 
(1 row)

DROP TABLE t, t_heap, t2;
SELECT duckdb.raw_query($$ SELECT database_name, schema_name, sql FROM duckdb_tables() $$);
NOTICE:  result: database_name	schema_name	sql	
VARCHAR	VARCHAR	VARCHAR	
[ Rows: 0]


 raw_query 
-----------
 
(1 row)

CREATE TABLE t(a int);
ERROR:  Only TEMP tables are supported in DuckDB
CREATE TEMP TABLE t(a int, b int GENERATED ALWAYS AS (a + 1) STORED);
ERROR:  DuckDB does not support STORED generated columns
CREATE TEMP TABLE t(a int GENERATED ALWAYS AS IDENTITY);
ERROR:  Identity columns are not supported in DuckDB
-- allowed but all other collations are not supported
CREATE TEMP TABLE t(a text COLLATE "default");
DROP TABLE t;
CREATE TEMP TABLE t(a text COLLATE "C");
ERROR:  DuckDB does not support column collations
CREATE TEMP TABLE t(a text COLLATE "de-x-icu");
ERROR:  DuckDB does not support column collations
CREATE TEMP TABLE t(A text COMPRESSION "pglz");
ERROR:  Column compression is not supported in DuckDB
CREATE TEMP TABLE t(a int) WITH (fillfactor = 50);
ERROR:  Storage options are not supported in DuckDB
CREATE TEMP TABLE t(a int) ON COMMIT PRESERVE ROWS;
INSERT INTO t VALUES (1);
SELECT * FROM t;
 a 
---
 1
(1 row)

DROP TABLE t;
CREATE TEMP TABLE t(a int) ON COMMIT DELETE ROWS;
INSERT INTO t VALUES (1);
SELECT * FROM t;
 a 
---
(0 rows)

DROP TABLE t;
-- unsupported
CREATE TEMP TABLE t(a int) ON COMMIT DROP;
ERROR:  DuckDB does not support ON COMMIT DROP
CREATE TEMP TABLE webpages USING duckdb AS SELECT * FROM read_csv('../../data/web_page.csv') as (column00 int, column01 text, column02 date);
ERROR:  DuckDB does not support CREATE TABLE AS yet
CREATE TEMP TABLE t(a int);
ALTER TABLE t ADD COLUMN b int;
ERROR:  DuckDB does not support ALTER TABLE yet
-- XXX: A better error message would be nice here, but for now this is acceptable.
ALTER TABLE t SET ACCESS METHOD heap;
ERROR:  duckdb does not implement duckdb_slot_callbacks
DROP TABLE t;
CREATE TEMP TABLE t(a int) USING heap;
ALTER TABLE t ADD COLUMN b int;
ALTER TABLE t SET ACCESS METHOD duckdb;
ERROR:  duckdb does not implement duckdb_slot_callbacks
